{
  "version": 1,
  "name": "Built-in LaTeX snippets",
  "description": "Built-in LaTeX snippet library for Eukolia.",
  "namespace": "latex",
  "language": "latex",
  "snippets": [
    {
      "id": "item",
      "trigger": {
        "pattern": "item"
      },
      "description": "\\item on a newline",
      "expand": "auto",
      "body": "\n\\item "
    },
    {
      "id": "subscript",
      "trigger": {
        "pattern": "__"
      },
      "description": "subscript",
      "expand": "auto",
      "body": "_{${1:${VISUAL}}}"
    },
    {
      "id": "superscript",
      "trigger": {
        "pattern": "\\*\\*"
      },
      "description": "superscript",
      "expand": "auto",
      "body": "^{${1:${VISUAL}}}"
    },
    {
      "id": "dots",
      "trigger": {
        "pattern": "\\.\\.\\."
      },
      "description": "\\dots",
      "expand": "auto",
      "body": "\\dots"
    },
    {
      "id": "equation",
      "trigger": {
        "pattern": "BEQ"
      },
      "description": "equation environment",
      "expand": "auto",
      "body": [
        {
          "type": "text",
          "value": "\\begin{equation}\n\t"
        },
        {
          "type": "tabstop",
          "index": 1,
          "default": "${VISUAL}"
        },
        {
          "type": "text",
          "value": "\n\\end{equation}"
        },
        {
          "type": "tabstop",
          "index": 0
        }
      ]
    },
    {
      "id": "equation-2",
      "trigger": {
        "pattern": "BSEQ"
      },
      "description": "equation* environment",
      "expand": "auto",
      "body": [
        {
          "type": "text",
          "value": "\\begin{equation*}\n\t"
        },
        {
          "type": "tabstop",
          "index": 1,
          "default": "${VISUAL}"
        },
        {
          "type": "text",
          "value": "\n\\end{equation*}"
        },
        {
          "type": "tabstop",
          "index": 0
        }
      ]
    },
    {
      "id": "align",
      "trigger": {
        "pattern": "BAL"
      },
      "description": "align environment",
      "expand": "auto",
      "body": [
        {
          "type": "text",
          "value": "\\begin{align}\n\t"
        },
        {
          "type": "tabstop",
          "index": 1,
          "default": "${VISUAL}"
        },
        {
          "type": "text",
          "value": "\n\\end{align}"
        },
        {
          "type": "tabstop",
          "index": 0
        }
      ]
    },
    {
      "id": "align-2",
      "trigger": {
        "pattern": "BSAL"
      },
      "description": "align* environment",
      "expand": "auto",
      "body": [
        {
          "type": "text",
          "value": "\\begin{align*}\n\t"
        },
        {
          "type": "tabstop",
          "index": 1,
          "default": "${VISUAL}"
        },
        {
          "type": "text",
          "value": "\n\\end{align*}"
        },
        {
          "type": "tabstop",
          "index": 0
        }
      ]
    },
    {
      "id": "gather",
      "trigger": {
        "pattern": "BGA"
      },
      "description": "gather environment",
      "expand": "auto",
      "body": [
        {
          "type": "text",
          "value": "\\begin{gather}\n\t"
        },
        {
          "type": "tabstop",
          "index": 1,
          "default": "${VISUAL}"
        },
        {
          "type": "text",
          "value": "\n\\end{gather}"
        },
        {
          "type": "tabstop",
          "index": 0
        }
      ]
    },
    {
      "id": "gather-2",
      "trigger": {
        "pattern": "BSGA"
      },
      "description": "gather* environment",
      "expand": "auto",
      "body": [
        {
          "type": "text",
          "value": "\\begin{gather*}\n\t"
        },
        {
          "type": "tabstop",
          "index": 1,
          "default": "${VISUAL}"
        },
        {
          "type": "text",
          "value": "\n\\end{gather*}"
        },
        {
          "type": "tabstop",
          "index": 0
        }
      ]
    },
    {
      "id": "multline",
      "trigger": {
        "pattern": "BMU"
      },
      "description": "multline environment",
      "expand": "auto",
      "body": [
        {
          "type": "text",
          "value": "\\begin{multline}\n\t"
        },
        {
          "type": "tabstop",
          "index": 1,
          "default": "${VISUAL}"
        },
        {
          "type": "text",
          "value": "\n\\end{multline}"
        },
        {
          "type": "tabstop",
          "index": 0
        }
      ]
    },
    {
      "id": "multline-2",
      "trigger": {
        "pattern": "BSMU"
      },
      "description": "multline* environment",
      "expand": "auto",
      "body": [
        {
          "type": "text",
          "value": "\\begin{multline*}\n\t"
        },
        {
          "type": "tabstop",
          "index": 1,
          "default": "${VISUAL}"
        },
        {
          "type": "text",
          "value": "\n\\end{multline*}"
        },
        {
          "type": "tabstop",
          "index": 0
        }
      ]
    },
    {
      "id": "itemize",
      "trigger": {
        "pattern": "BIT"
      },
      "description": "itemize environment",
      "expand": "auto",
      "body": [
        {
          "type": "text",
          "value": "\\begin{itemize}\n\t\\item "
        },
        {
          "type": "tabstop",
          "index": 1,
          "default": "${VISUAL}"
        },
        {
          "type": "text",
          "value": "\n\\end{itemize}"
        },
        {
          "type": "tabstop",
          "index": 0
        }
      ]
    },
    {
      "id": "enumerate",
      "trigger": {
        "pattern": "BEN"
      },
      "description": "enumerate environment",
      "expand": "auto",
      "body": [
        {
          "type": "text",
          "value": "\\begin{enumerate}\n\t\\item "
        },
        {
          "type": "tabstop",
          "index": 1,
          "default": "${VISUAL}"
        },
        {
          "type": "text",
          "value": "\n\\end{enumerate}"
        },
        {
          "type": "tabstop",
          "index": 0
        }
      ]
    },
    {
      "id": "split",
      "trigger": {
        "pattern": "BSPL"
      },
      "description": "split environment",
      "expand": "auto",
      "body": [
        {
          "type": "text",
          "value": "\\begin{split}\n\t"
        },
        {
          "type": "tabstop",
          "index": 1,
          "default": "${VISUAL}"
        },
        {
          "type": "text",
          "value": "\n\\end{split}"
        },
        {
          "type": "tabstop",
          "index": 0
        }
      ]
    },
    {
      "id": "cases",
      "trigger": {
        "pattern": "BCAS"
      },
      "description": "cases environment",
      "expand": "auto",
      "body": [
        {
          "type": "text",
          "value": "\\begin{cases}\n\t"
        },
        {
          "type": "tabstop",
          "index": 1,
          "default": "${VISUAL}"
        },
        {
          "type": "text",
          "value": "\n\\end{cases}"
        },
        {
          "type": "tabstop",
          "index": 0
        }
      ]
    },
    {
      "id": "frame",
      "trigger": {
        "pattern": "BFR"
      },
      "description": "frame",
      "expand": "auto",
      "body": [
        {
          "type": "text",
          "value": "\\begin{frame}\n\t\\frametitle{"
        },
        {
          "type": "tabstop",
          "index": 1,
          "default": "<title>"
        },
        {
          "type": "text",
          "value": "}\n\n\t"
        },
        {
          "type": "tabstop",
          "index": 2,
          "default": "${VISUAL}"
        },
        {
          "type": "text",
          "value": "\n\n\\end{frame}"
        },
        {
          "type": "tabstop",
          "index": 0
        }
      ]
    },
    {
      "id": "figure",
      "trigger": {
        "pattern": "BFI"
      },
      "description": "figure",
      "expand": "auto",
      "body": [
        {
          "type": "text",
          "value": "\\begin{figure}["
        },
        {
          "type": "tabstop",
          "index": 1,
          "default": "htbp"
        },
        {
          "type": "text",
          "value": "]\n\t\\centering\n\t"
        },
        {
          "type": "tabstop",
          "index": 2,
          "default": "${VISUAL}"
        },
        {
          "type": "text",
          "value": "\n\t\\caption{"
        },
        {
          "type": "tabstop",
          "index": 2,
          "default": "<caption>"
        },
        {
          "type": "text",
          "value": "}\n\t\\label{"
        },
        {
          "type": "tabstop",
          "index": 3,
          "default": "<label>"
        },
        {
          "type": "text",
          "value": "}\n\\end{figure}"
        },
        {
          "type": "tabstop",
          "index": 0
        }
      ]
    },
    {
      "id": "table-caption-after-tabular",
      "trigger": {
        "pattern": "BTA"
      },
      "description": "table",
      "expand": "auto",
      "body": [
        {
          "type": "text",
          "value": "\\begin{table}["
        },
        {
          "type": "tabstop",
          "index": 1,
          "default": "htbp"
        },
        {
          "type": "text",
          "value": "]\n\t\\centering\n\t\\begin{tabular}{"
        },
        {
          "type": "tabstop",
          "index": 4,
          "default": "<columns>"
        },
        {
          "type": "text",
          "value": "}\n\t\t"
        },
        {
          "type": "tabstop",
          "index": 5,
          "default": "${VISUAL}"
        },
        {
          "type": "text",
          "value": "\n\t\\end{tabular}\n\t\\caption{"
        },
        {
          "type": "tabstop",
          "index": 2,